Title,Abstract,Date,Authors,Cluster
Complex Systems of Secrecy: The Offshore Networks of Oligarchs,"Following the invasion of Ukraine, the US, UK, and EU governments--among
others--sanctioned oligarchs close to Putin. This approach has come under
scrutiny, as evidence has emerged of the oligarchs' successful evasion of these
punishments. To address this problem, we analyze the role of an overlooked but
highly influential group: the secretive professional intermediaries who create
and administer the oligarchs' offshore financial empires. Drawing on the
Offshore Leaks Database provided by the International Consortium of
Investigative Journalists (ICIJ), we examine the ties linking offshore expert
advisors (lawyers, accountants, and other wealth management professionals) to
ultra-high-net-worth individuals from four countries: Russia, China, the United
States, and Hong Kong. We find that resulting nation-level ""oligarch networks""
share a scale-free structure characterized by heterogeneity of heavy-tailed
degree distributions of wealth managers; however, network topologies diverge
across clients from democratic versus autocratic regimes. While generally
robust, scale-free networks are fragile when targeted by attacks on
highly-connected nodes. Our ""knock-out"" experiments pinpoint this vulnerability
to the small group of wealth managers themselves, suggesting that sanctioning
these professional intermediaries may be more effective and efficient in
disrupting dark finance flows than sanctions on their wealthy clients. This
vulnerability is especially pronounced amongst Russian oligarchs, who
concentrate their offshore business in a handful of boutique wealth management
firms. The distinctive patterns we identify suggest a new approach to
sanctions, focused on expert intermediaries to disrupt the finances and
alliances of their wealthy clients. More generally, our research contributes to
the larger body of work on complexity science and the structures of secrecy.",2023-03-06,"Ho-Chun Herbert Chang, Brooke Harrington, Feng Fu, Daniel Rockmore",0
"A Golden Age: Conspiracy Theories' Relationship with Misinformation
  Outlets, News Media, and the Wider Internet","Do we live in a ""Golden Age of Conspiracy Theories?"" In the last few decades,
conspiracy theories have proliferated on the Internet with some having
dangerous real-world consequences. A large contingent of those who participated
in the January 6th attack on the US Capitol fervently believed in the QAnon
conspiracy theory. In this work, we study the relationships amongst five
prominent conspiracy theories (QAnon, COVID, UFO/Aliens, 9/11, and Flat-Earth)
and each of their respective relationships to the news media, both authentic
news and misinformation. Identifying and publishing a set of 755 different
conspiracy theory websites dedicated to our five conspiracy theories, we find
that each set often hyperlinks to the same external domains, with COVID and
QAnon conspiracy theory websites having the largest amount of shared
connections. Examining the role of news media, we further find that not only do
outlets known for spreading misinformation hyperlink to our set of conspiracy
theory websites more often than authentic news websites but also that this
hyperlinking increased dramatically between 2018 and 2021, with the advent of
QAnon and the start of COVID-19 pandemic. Using partial Granger-causality, we
uncover several positive correlative relationships between the hyperlinks from
misinformation websites and the popularity of conspiracy theory websites,
suggesting the prominent role that misinformation news outlets play in
popularizing many conspiracy theories.",2023-01-26,"Hans W. A. Hanley, Deepak Kumar, Zakir Durumeric",0
"Discovering the Traces of Disinformation on Instagram in the Internet
  Archive","Disinformation, which is fabricated, misleading content spread with the
intent to deceive others, is accumulating substantial engagements and reaching
a vast audience on Instagram. However, the temporary nature of the platform and
the security guidelines that remove malicious content make studying this
disinformation a challenge. The only way to access removed content and banned
accounts that are no longer on the live web is by searching the web archives.
In this study, we set out to quantify the replayability and quality of past
captures of Instagram account pages, specifically focusing on a group of
anti-vaxx content creators known as the Disinformation Dozen. We found that the
number of mementos listed for these users' account pages on the Internet
Archive's Wayback Machine can be misleading, because a majority of the mementos
are actually redirections to the Instagram login page, and of the remaining
replayable mementos, many are missing post images. In fact, 96.13% of mementos
from the Disinformation Dozen accounts redirect to the login page, and only
27.16% of the remaining replayable mementos contain every post image. Combined,
these results reveal that merely 1.05% of mementos for the Disinformation Dozen
accounts are replayable with complete post images. Furthermore, we found that
the percentage of replayable mementos is decreasing over time, with a
particular lack of replayable mementos for the years 2021 and 2022.",2023-01-22,"Haley Bragg, Michele Weigle",0
"MHVG2MTS: Multilayer Horizontal Visibility Graphs for Multivariate Time
  Series Analysis","Understanding the properties of time-indexed multivariate data has been a
predominant topic mainly to address open issues in multivariate time series
analysis. Usually, the methodologies used to analyze multivariate time series
are based on adapting approaches for univariate settings or on assumptions and
parameters for specific problems. A different strategy uses complex network to
obtain an additional and reduced representation of temporal and causal
properties of the time series data. Recent strategies involve mapping
multivariate time series into high-level network structures, specifically into
multiplex networks representing interconnections between contemporary
timestamps of different time series components. In this work, we propose a new
mapping method that takes advantage of the entire structure of multilayer
networks. We introduce the multilayer horizontal visibility graph that is based
on the new concept of cross-horizontal visibility between lagged timestamps of
different components, which allows describing the cross-dimension dependencies
via inter-layer edges. We use a set of existing topological measures of
multilayer networks as well as a novel measure to evaluate and validate our
approach, which is parameter-free, does not require data pre-processing and is
applicable to any kind of multivariate time series data. We provide an
extensive experimental evaluation, where we explore the proposed topological
measures, showing that the inter-layer edges based on cross-horizontal
visibility preserve more information about the time series data after the
mappings, information that would inevitably be lost using mapping methods that
result in single-layer and multiplex structures. We also verify that the
information mapped by the inter-layer edges is not enough on its own, but that
it complements the data information captured by the commonly used intra-layer
edges.",2023-01-05,"Vanessa Freitas Silva, Maria Eduarda Silva, Pedro Ribeiro, Fernando Silva",0
"Piecewise-Velocity Model for Learning Continuous-time Dynamic Node
  Representations","Networks have become indispensable and ubiquitous structures in many fields
to model the interactions among different entities, such as friendship in
social networks or protein interactions in biological graphs. A major challenge
is to understand the structure and dynamics of these systems. Although networks
evolve through time, most existing graph representation learning methods target
only static networks. Whereas approaches have been developed for the modeling
of dynamic networks, there is a lack of efficient continuous time dynamic graph
representation learning methods that can provide accurate network
characterization and visualization in low dimensions while explicitly
accounting for prominent network characteristics such as homophily and
transitivity. In this paper, we propose the Piecewise-Velocity Model (PiVeM)
for the representation of continuous-time dynamic networks. It learns dynamic
embeddings in which the temporal evolution of nodes is approximated by
piecewise linear interpolations based on a latent distance model with piecewise
constant node-specific velocities. The model allows for analytically tractable
expressions of the associated Poisson process likelihood with scalable
inference invariant to the number of events. We further impose a scalable
Kronecker structured Gaussian Process prior to the dynamics accounting for
community structure, temporal smoothness, and disentangled (uncorrelated)
latent embedding dimensions optimally learned to characterize the network
dynamics. We show that PiVeM can successfully represent network structure and
dynamics in ultra-low two-dimensional spaces. It outperforms relevant
state-of-art methods in downstream tasks such as link prediction. In summary,
PiVeM enables easily interpretable dynamic network visualizations and
characterizations that can further improve our understanding of the intrinsic
dynamics of time-evolving networks.",2022-12-23,"Abdulkadir Çelikkanat, Nikolaos Nakis, Morten Mørup",0
A Non-Asymptotic Analysis of Oversmoothing in Graph Neural Networks,"Oversmoothing is a central challenge of building more powerful Graph Neural
Networks (GNNs). While previous works have only demonstrated that oversmoothing
is inevitable when the number of graph convolutions tends to infinity, in this
paper, we precisely characterize the mechanism behind the phenomenon via a
non-asymptotic analysis. Specifically, we distinguish between two different
effects when applying graph convolutions -- an undesirable mixing effect that
homogenizes node representations in different classes, and a desirable
denoising effect that homogenizes node representations in the same class. By
quantifying these two effects on random graphs sampled from the Contextual
Stochastic Block Model (CSBM), we show that oversmoothing happens once the
mixing effect starts to dominate the denoising effect, and the number of layers
required for this transition is $O(\log N/\log (\log N))$ for sufficiently
dense graphs with $N$ nodes. We also extend our analysis to study the effects
of Personalized PageRank (PPR), or equivalently, the effects of initial
residual connections on oversmoothing. Our results suggest that while PPR
mitigates oversmoothing at deeper layers, PPR-based architectures still achieve
their best performance at a shallow depth and are outperformed by the graph
convolution approach on certain graphs. Finally, we support our theoretical
results with numerical experiments, which further suggest that the
oversmoothing phenomenon observed in practice can be magnified by the
difficulty of optimizing deep GNN models.",2022-12-21,"Xinyi Wu, Zhengdao Chen, William Wang, Ali Jadbabaie",0
An Approach for Detecting Dynamic Communities in Social Networks,"Recent developments in the internet and technology have made major
advancements in tools that facilitate the collection of social data, opening up
thus new opportunities for analyzing social networks. Social network analysis
studies the patterns of social relations and aims at discovering the hidden
features embedded in the structure of social networks. One of the most
important features in social networks is community structure : densely knit
groups of individuals. The dynamic nature of interaction in social networks
often challenges the detection of such community structures. The contributions
in this thesis fall into two categories.The first category highlights the
problem of identifying overlapping communities over time. To carry out such
analysis, a framework called OLCPM (Online Label propagation and Clique
Percolation Method) is proposed. It is an online algorithm based on clique
percolation and label propagation methods. OLCPM has two main features : the
first one is its ability to discover overlapping communities, while the second
is its effectiveness in handling fine-grained temporal net works. As for as the
second category is concerned, it emphasizes on the problem of analyzing
communities that are embedded at different temporal scales. For example, in
networks of interaction such as e-mails or phone calls, individuals are
involved in daily as well as occasional conversations. We propose a first
method for analyzing communities at multiple temporal scales. Hence, the
dynamic network (link streams) is studied at different temporal granularities,
and coherent communities (called stable communities) over a period of time are
detected at each temporal granularity. The two proposed approaches are
validated on both synthetic and real-world datasets.",2022-12-05,Souaad Boudebza,0
"Leveraging Users' Social Network Embeddings for Fake News Detection on
  Twitter","Social networks (SNs) are increasingly important sources of news for many
people. The online connections made by users allows information to spread more
easily than traditional news media (e.g., newspaper, television). However, they
also make the spread of fake news easier than in traditional media, especially
through the users' social network connections. In this paper, we focus on
investigating if the SNs' users connection structure can aid fake news
detection on Twitter. In particular, we propose to embed users based on their
follower or friendship networks on the Twitter platform, so as to identify the
groups that users form. Indeed, by applying unsupervised graph embedding
methods on the graphs from the Twitter users' social network connections, we
observe that users engaged with fake news are more tightly clustered together
than users only engaged in factual news. Thus, we hypothesise that the embedded
user's network can help detect fake news effectively. Through extensive
experiments using a publicly available Twitter dataset, our results show that
applying graph embedding methods on SNs, using the user connections as network
information, can indeed classify fake news more effectively than most
language-based approaches. Specifically, we observe a significant improvement
over using only the textual information (i.e., TF.IDF or a BERT language
model), as well as over models that deploy both advanced textual features
(i.e., stance detection) and complex network features (e.g., users network,
publishers cross citations). We conclude that the Twitter users' friendship and
followers network information can significantly outperform language-based
approaches, as well as the existing state-of-the-art fake news detection models
that use a more sophisticated network structure, in classifying fake news on
Twitter.",2022-11-19,"Ting Su, Craig Macdonald, Iadh Ounis",0
"Spreading processes with population heterogeneity over multi-layer
  networks","It's been controversial whether re-opening school will facilitate viral
spread among household communities with mitigation strategies such as
mask-wearing in place. In this work, we propose an epidemiological model that
explores the viral transmission over the multi-layer contact network composed
of the school layer and community layer with population heterogeneity on
mask-wearing behavior. We derive analytical expressions for three key
epidemiological quantities: the probability of emergence, the epidemic
threshold, and the expected epidemic size. In particular, we show how the
aforementioned quantities depend on the structure of the multi-layer contact
network, viral transmission dynamics, and the distribution of the different
types of masks within the population. Through extensive simulations, our
analytical results show near-perfect agreement with the simulation results with
a limited number of nodes. Utilizing the model, we study the impact of the
opening/closure of the school layer on the viral transmission dynamics with
various mask-wearing scenarios. Interestingly, we found that it's safe to open
the school layer with the proper proportion of good-quality masks in the
population. Moreover, we validate the theory of the trade-off between
source-control and self-protection over a single layer by Tian et al on our
multi-layer setting. We conclude that even on a multi-layer network, it's of
great significance to treat the spreading process as two distinct phases in
mind when considering mitigation strategies. Besides, we would like to remark
that our model of spreading process over multi-layer networks with population
heterogeneity can also be applied to various other domains, such as
misinformation control.",2022-11-14,"Yurun Tian, Osman Yagan",0
"Coupled dynamics of endemic disease transmission and gradual awareness
  diffusion in multiplex networks","Understanding the interplay between human behavioral phenomena and infectious
disease dynamics has been one of the central challenges of mathematical
epidemiology. However, socio-cognitive processes critical for the initiation of
desired behavioral responses during an outbreak have often been neglected or
oversimplified in earlier models. Combining the microscopic Markov chain
approach with the law of total probability, we herein institute a mathematical
model describing the dynamic interplay between stage-based progression of
awareness diffusion and endemic disease transmission in multiplex networks. We
analytically derived the epidemic thresholds for both discrete-time and
continuous-time versions of our model, and we numerically demonstrated the
accuracy of our analytic arguments in capturing the time course and the
steady-state of the coupled disease-awareness dynamics. We found that our model
is exact for arbitrary unclustered multiplex networks, outperforming a widely
adopted probability-tree-based method, both in the prediction of the
time-evolution of a contagion and in the final epidemic size. Our findings show
that informing the unaware individuals about the circulating disease will not
be sufficient for the prevention of an outbreak unless the distributed
information triggers strong awareness of infection risks with adequate
protective measures, and that the immunity of highly-aware individuals can
elevate the epidemic threshold, but only if the rate of transition from weak to
strong awareness is sufficiently high. Our study thus reveals that awareness
diffusion and other behavioral parameters can nontrivially interact when
producing their effects on epidemiological dynamics of an infectious disease,
suggesting that future public health measures should not ignore this complex
behavioral interplay and its influence on contagion transmission in
multilayered networked systems.",2022-10-21,"Qingchu Wu, Tarik Hadzibeganovic, Xiao-Pu Han",0
Analyzing Social Media Activities at Bellingcat,"Open-source journalism emerged as a new phenomenon in the media ecosystem,
which uses crowdsourcing to fact-check and generate investigative reports for
world events using open sources (e.g., social media). A particularly prominent
example is Bellingcat. Bellingcat is known for its investigations on the
illegal use of chemical weapons during the Syrian war, the Russian
responsibility for downing flight MH17, the identification of the perpetrators
in the attempted murder of Alexei Navalny, and war crimes in the Russo-Ukraine
war. Crucial for this is social media in order to disseminate findings and
crowdsource fact-checks. In this work, we characterize the social media
activities at Bellingcat on Twitter. For this, we built a comprehensive dataset
of all N=24,682 tweets posted by Bellingcat on Twitter since its inception in
July 2014. Our analysis is three-fold: (1) We analyze how Bellingcat uses
Twitter to disseminate information and collect information from its follower
base. Here, we find a steady increase in both posts and replies over time,
particularly during the Russo-Ukrainian war, which is in line with the growing
importance of Bellingcat for the traditional media ecosystem. (2) We identify
characteristics of posts that are successful in eliciting user engagement. User
engagement is particularly large for posts embedding additional media items and
with a more negative sentiment. (3) We examine how the follower base has
responded to the Russian invasion of Ukraine. Here, we find that the sentiment
has become more polarized and negative. We attribute this to a ~13-fold
increase in bots interacting with the Bellingcat account. Overall, our findings
provide recommendations for how open-source journalism such as Bellingcat can
successfully operate on social media.",2022-09-21,"Dominik Bär, Fausto Calderon, Michael Lawlor, Sophia Licklederer, Manuel Totzauer, Stefan Feuerriegel",0
"An Exploratory Study of Tweets about the SARS-CoV-2 Omicron Variant:
  Insights from Sentiment Analysis, Language Interpretation, Source Tracking,
  Type Classification, and Embedded URL Detection","This paper presents the findings of an exploratory study on the continuously
generating Big Data on Twitter related to the sharing of information, news,
views, opinions, ideas, feedback, and experiences about the COVID-19 pandemic,
with a specific focus on the Omicron variant, which is the globally dominant
variant of SARS-CoV-2 at this time. A total of 12028 tweets about the Omicron
variant were studied, and the specific characteristics of tweets that were
analyzed include - sentiment, language, source, type, and embedded URLs. The
findings of this study are manifold. First, from sentiment analysis, it was
observed that 50.5% of tweets had a neutral emotion. The other emotions - bad,
good, terrible, and great were found in 15.6%, 14.0%, 12.5%, and 7.5% of the
tweets, respectively. Second, the findings of language interpretation showed
that 65.9% of the tweets were posted in English. It was followed by Spanish,
French, Italian, and other languages. Third, the findings from source tracking
showed that Twitter for Android was associated with 35.2% of tweets. It was
followed by Twitter Web App, Twitter for iPhone, Twitter for iPad, and other
sources. Fourth, studying the type of tweets revealed that retweets accounted
for 60.8% of the tweets, it was followed by original tweets and replies that
accounted for 19.8% and 19.4% of the tweets, respectively. Fifth, in terms of
embedded URL analysis, the most common domain embedded in the tweets was found
to be twitter.com, which was followed by biorxiv.org, nature.com, and other
domains. Finally, to support similar research in this field, we have developed
a Twitter dataset that comprises more than 500,000 tweets about the SARS-CoV-2
omicron variant since the first detected case of this variant on November 24,
2021.",2022-07-20,"Nirmalya Thakur, Chia Y. Han",0
"Assessing the Effects of Hyperparameters on Knowledge Graph Embedding
  Quality","Embedding knowledge graphs into low-dimensional spaces is a popular method
for applying approaches, such as link prediction or node classification, to
these databases. This embedding process is very costly in terms of both
computational time and space. Part of the reason for this is the optimisation
of hyperparameters, which involves repeatedly sampling, by random, guided, or
brute-force selection, from a large hyperparameter space and testing the
resulting embeddings for their quality. However, not all hyperparameters in
this search space will be equally important. In fact, with prior knowledge of
the relative importance of the hyperparameters, some could be eliminated from
the search altogether without significantly impacting the overall quality of
the outputted embeddings. To this end, we ran a Sobol sensitivity analysis to
evaluate the effects of tuning different hyperparameters on the variance of
embedding quality. This was achieved by performing thousands of embedding
trials, each time measuring the quality of embeddings produced by different
hyperparameter configurations. We regressed the embedding quality on those
hyperparameter configurations, using this model to generate Sobol sensitivity
indices for each of the hyperparameters. By evaluating the correlation between
Sobol indices, we find substantial variability in the hyperparameter
sensitivities between knowledge graphs, with differing dataset characteristics
being the probable cause of these inconsistencies. As an additional
contribution of this work we identify several relations in the UMLS knowledge
graph that may cause data leakage via inverse relations, and derive and present
UMLS-43, a leakage-robust variant of that graph.",2022-07-01,"Oliver Lloyd, Yi Liu, Tom Gaunt",0
