Title,Abstract,Date,Authors,Cluster
"The Impact Of Social Media In The Fight Against The Spread Of
  Coronavirus (Covid-19) Pandemic In Anambra State, Nigeria","This study examined the impact of social media in the fight against the
spread of coronavirus (COVID-19) pandemic in Anambra state, Nigeria. The key
objectives are to: find out if the numbers of social media users increased in
Anambra state since the wake of coronavirus pandemic; find out if the social
media is being utilised in the fight against the spread of coronavirus pandemic
in Anambra state; find out how the social media is being utilised in the fight
against the spread of coronavirus pandemic in Anambra state; and discover the
impact of social media in the fight against the spread of coronavirus pandemic
in Anambra State. It was anchored on Agenda Setting Theory, and the
Technological Determinism Theory (TDT). The study was designed as a survey with
close-ended questionnaire distributed to 400 respondents. The findings of this
study revealed that usage and accessibility of social media increased in
Anambra state because of coronavirus pandemic. It also revealed that the social
media is being utilised by individuals, NGOs and government in the fight
against the spread of coronavirus in Anambra state. The study also found that
the social media is being utilised to gather and disseminate information,
study, transact businesses, among other things. The finding also showed that
the social media has positive impact in the fight against the spread of
coronavirus in Anambra state. The study concluded that social media has much
benefits than negative impact, and should be used to contain the spread of
coronavirus. It, among other things, recommended training and empowerment of
the citizens on effective utilisation of social media to create impact in the
society.",2022-06-11,"Onuegbu Okechukwu Christopher, Joseph Oluchukwu Wogu, Jude Agbo",0
"An Approach to Investigate Public Opinion, Views, and Perspectives
  Towards Exoskeleton Technology","Over the last decade, exoskeletons have had an extensive impact on different
disciplines and application domains such as assisted living, military,
healthcare, firefighting, and industries, on account of their diverse and
dynamic functionalities to augment human abilities, stamina, potential, and
performance in a multitude of ways. In view of this wide-scale applicability
and use-cases of exoskeletons, it is crucial to investigate and analyze the
public opinion, views, and perspectives towards exoskeletons which would help
to interpret the effectiveness of the underlining human-robot, human-machine,
and human-technology interactions. The Internet of Everything era of today's
living, characterized by people spending more time on the internet than ever
before, holds the potential for the investigation of the same by mining and
analyzing relevant web behavior, specifically from social media, that can be
interpreted to understand public opinion, views, and perspectives towards a
topic or set of topics. Therefore, this paper aims to address this research
challenge related to exoskeletons by utilizing the potential of web
behavior-based Big Data mining in the modern-day Internet of Everything era. As
Twitter is one of the most popular social media platforms on a global scale -
characterized by both the number of users and the amount of time spent by its
users on the platform - this work focused on investigating web behavior on
Twitter to interpret the public opinion, views, and perspectives towards
exoskeleton technology. A total of approximately 20,000 tweets related to
exoskeletons were used to evaluate the effectiveness of the proposed approach.
The results presented and discussed uphold the efficacy of the proposed
approach to interpret and analyze the public opinion, views, and perspectives
towards exoskeletons from the associated tweets.",2022-04-27,"Nirmalya Thakur, Cat Luong, Chia Y. Han",0
"Characterizing Reddit Participation of Users Who Engage in the QAnon
  Conspiracy Theories","Widespread conspiracy theories may significantly impact our society. This
paper focuses on the QAnon conspiracy theory, a consequential conspiracy theory
that started on and disseminated successfully through social media. Our work
characterizes how Reddit users who have participated in QAnon-focused
subreddits engage in activities on the platform, especially outside their own
communities. Using a large-scale Reddit moderation action against QAnon-related
activities in 2018 as the source, we identified 13,000 users active in the
early QAnon communities. We collected the 2.1 million submissions and 10.8
million comments posted by these users across all of Reddit from October 2016
to January 2021. The majority of these users were only active after the
emergence of the QAnon Conspiracy theory and decreased in activity after
Reddit's 2018 QAnon ban. A qualitative analysis of a sample of 915 subreddits
where the ""QAnon-enthusiastic"" users were especially active shows that they
participated in a diverse range of subreddits, often of unrelated topics to
QAnon. However, most of the users' submissions were concentrated in subreddits
that have sympathetic attitudes towards the conspiracy theory, characterized by
discussions that were pro-Trump, or emphasized unconstricted behavior (often
anti-establishment and anti-interventionist). Further study of a sample of
1,571 of these submissions indicates that most consist of links from
low-quality sources, bringing potential harm to the broader Reddit community.
These results point to the likelihood that the activities of early QAnon users
on Reddit were dedicated and committed to the conspiracy, providing
implications on both platform moderation design and future research.",2022-03-14,"Kristen Engel, Yiqing Hua, Taixiang Zeng, Mor Naaman",0
"ONBRA: Rigorous Estimation of the Temporal Betweenness Centrality in
  Temporal Networks","In network analysis, the betweenness centrality of a node informally captures
the fraction of shortest paths visiting that node. The computation of the
betweenness centrality measure is a fundamental task in the analysis of modern
networks, enabling the identification of the most central nodes in such
networks. Additionally to being massive, modern networks also contain
information about the time at which their events occur. Such networks are often
called temporal networks. The temporal information makes the study of the
betweenness centrality in temporal networks (i.e., temporal betweenness
centrality) much more challenging than in static networks (i.e., networks
without temporal information). Moreover, the exact computation of the temporal
betweenness centrality is often impractical on even moderately-sized networks,
given its extremely high computational cost. A natural approach to reduce such
computational cost is to obtain high-quality estimates of the exact values of
the temporal betweenness centrality. In this work we present ONBRA, the first
sampling-based approximation algorithm for estimating the temporal betweenness
centrality values of the nodes in a temporal network, providing rigorous
probabilistic guarantees on the quality of its output. ONBRA is able to compute
the estimates of the temporal betweenness centrality values under two different
optimality criteria for the shortest paths of the temporal network. In
addition, ONBRA outputs high-quality estimates with sharp theoretical
guarantees leveraging on the \emph{empirical Bernstein bound}, an advanced
concentration inequality. Finally, our experimental evaluation shows that ONBRA
significantly reduces the computational resources required by the exact
computation of the temporal betweenness centrality on several real world
networks, while reporting high-quality estimates with rigorous guarantees.",2022-03-01,"Diego Santoro, Ilie Sarpe",0
"SimGRACE: A Simple Framework for Graph Contrastive Learning without Data
  Augmentation","Graph contrastive learning (GCL) has emerged as a dominant technique for
graph representation learning which maximizes the mutual information between
paired graph augmentations that share the same semantics. Unfortunately, it is
difficult to preserve semantics well during augmentations in view of the
diverse nature of graph data. Currently, data augmentations in GCL that are
designed to preserve semantics broadly fall into three unsatisfactory ways.
First, the augmentations can be manually picked per dataset by
trial-and-errors. Second, the augmentations can be selected via cumbersome
search. Third, the augmentations can be obtained by introducing expensive
domain-specific knowledge as guidance. All of these limit the efficiency and
more general applicability of existing GCL methods. To circumvent these crucial
issues, we propose a \underline{Sim}ple framework for \underline{GRA}ph
\underline{C}ontrastive l\underline{E}arning, \textbf{SimGRACE} for brevity,
which does not require data augmentations. Specifically, we take original graph
as input and GNN model with its perturbed version as two encoders to obtain two
correlated views for contrast. SimGRACE is inspired by the observation that
graph data can preserve their semantics well during encoder perturbations while
not requiring manual trial-and-errors, cumbersome search or expensive domain
knowledge for augmentations selection. Also, we explain why SimGRACE can
succeed. Furthermore, we devise adversarial training scheme, dubbed
\textbf{AT-SimGRACE}, to enhance the robustness of graph contrastive learning
and theoretically explain the reasons. Albeit simple, we show that SimGRACE can
yield competitive or better performance compared with state-of-the-art methods
in terms of generalizability, transferability and robustness, while enjoying
unprecedented degree of flexibility and efficiency.",2022-02-07,"Jun Xia, Lirong Wu, Jintao Chen, Bozhen Hu, Stan Z. Li",0
